{
  "id": "4b751a8e-3dce-4f29-8b1a-4e7db45a98fe",
  "type": "character",
  "name": "James Bond",
  "description": "British MI6 agent 007 and protagonist of Ian Fleming's spy novels.",
  "content": [
    {
      "title": "Background",
      "body": "James Bond is a fictional British Secret Service agent created by Ian Fleming in 1953. Bond holds the code number 007, signifying his license to kill. His past includes service in the Royal Navy during World War II and extensive training in espionage, combat, and survival."
    },
    {
      "title": "Personality",
      "body": "Bond is characterized by confidence, sophistication, and charm, often displaying a cool demeanor under pressure. Despite his professionalism, he is vulnerable to emotional complexities, especially evident in his relationships with women. His wit and elegance mask a ruthless efficiency and pragmatism necessary for his dangerous work."
    },
    {
      "title": "Story Role",
      "body": "As the central protagonist of Ian Fleming's novels and the subsequent film adaptations, Bond undertakes perilous espionage missions, frequently facing geopolitical threats and personal adversaries. In 'Casino Royale', Bondâ€™s mission is to defeat Le Chiffre in a baccarat game, which tests both his intelligence and resilience."
    },
    {
      "title": "Relationships",
      "body": "Bond's relationships are marked by transient romantic encounters, including the significant and tragic connection with Vesper Lynd in 'Casino Royale'. He collaborates closely with MI6 personnel such as M, Miss Moneypenny, Q, and ally Felix Leiter. His antagonists often include Cold War-era villains like Le Chiffre."
    },
    {
      "title": "Abilities and Skills",
      "body": "Bond excels in hand-to-hand combat, marksmanship, and tactical intelligence gathering. He is a master of disguise, fluent in multiple languages, and highly skilled in gambling and strategic thinking. His resilience and adaptability make him a formidable spy."
    }
  ],
  "aliases": [
    "007",
    "Agent 007",
    "Commander Bond",
    "James Bond, CMG, RN"
  ],
  "relationships": [
    {
      "type": "created_by",
      "target": "e5e8a4b9-2137-4f7c-9030-8d2c3e7f3521"
    },
    {
      "type": "member_of",
      "target": "50fa1b1e-8679-4b51-9646-e429e7c9da31"
    },
    {
      "type": "interacts_with",
      "target": "4d8ecfab-7db7-4e8c-a2ba-2e0dea54ce91"
    },
    {
      "type": "interacts_with",
      "target": "7b3b796d-02f6-4e16-a55c-4b5f0b9db1e2"
    },
    {
      "type": "interacts_with",
      "target": "a7dd4634-3f53-4ce3-9adc-49273238e25a"
    },
    {
      "type": "interacts_with",
      "target": "2d0a0ec6-6fdb-4cb8-b3af-9314e8f6a0ba"
    },
    {
      "type": "antagonist_to",
      "target": "e4f2568b-8c69-4e8a-9cf3-b12584970a29"
    },
    {
      "type": "romantic_interest",
      "target": "9e0bb743-cfe4-4f32-866a-fad4a4d53715"
    },
    {
      "type": "associated_with",
      "target": "d1d75703-547e-4912-b4b9-c0f9312d7483"
    },
    {
      "type": "associated_with",
      "target": "cb746d10-0b57-4d72-b8e8-5d9b782d92f6"
    }
  ],
  "properties": {
    "nationality": "British",
    "code_number": "007",
    "occupation": "Secret Agent / Spy",
    "allegiance": "MI6"
  },
  "tags": [
    "protagonist",
    "spy",
    "British secret agent",
    "fictional character",
    "James Bond franchise"
  ]
}