{
  "id": "9bce6b75-1663-400b-a7d1-cc0c9327f4b3",
  "type": "organization",
  "name": "Independent Traders",
  "description": "A group of astute, self-reliant starship traders who play a vital role in the galaxyâ€™s economy during the decline of the Galactic Empire.",
  "content": [
    {
      "title": "Overview",
      "body": "Independent Traders are private starfaring merchants operating on the edges of galactic society, providing vital goods and services between star systems amidst the fading influence of the Galactic Empire. They function outside the direct control of the Empire or later the Foundation, forming their own networks and alliances based on commerce, survival, and negotiation. Their ships are often smaller and more adaptable than traditional military vessels, enabling maneuverability and trade in less regulated sectors."
    },
    {
      "title": "Structure",
      "body": "This loosely organized network consists mainly of entrepreneurial captains and their crews, who manage their own vessels independently or as part of small merchant fleets. Unlike formal corporations or government-controlled trade organizations, the Independent Traders lack a centralized authority but coordinate through trade guilds or local alliances when beneficial. Their flexibility is a key feature, responding quickly to changes in market demands or political shifts, often crossing dangerous territories with cunning and skill."
    },
    {
      "title": "History",
      "body": "The Independent Traders emerged during the early decline of the Galactic Empire, as central authority weakened and trade routes became fragmented or dangerous. Many traders initially operated within Imperial space but increasingly retreated to frontier regions and unregulated sectors to escape bureaucracy and taxation. They thrived by filling the void left by declining Imperial institutions, often engaging in trade that was too minor or too risky for larger corporations. Over time, they gained reputations for both shrewdness and reliability, influencing economic patterns across many star systems."
    },
    {
      "title": "Goals",
      "body": "The primary goal of Independent Traders is profit through commerce by maintaining access to diverse markets and securing safe passage through volatile regions. Many prioritize independence from dominating authorities, seeking to preserve freedom of navigation and business. Some have more ambitious aims, such as controlling key trade routes or establishing lasting trade conglomerates, but generally, independence and adaptability define their purpose."
    },
    {
      "title": "Key Members",
      "body": "Prominent figures among Independent Traders typically include charismatic ship captains, skilled negotiators, and logistics experts. While individual personalities vary widely, those who demonstrate tactical brilliance or exceptionally successful ventures sometimes gain notoriety and respect within the trader community, forming informal leadership circles or alliances."
    }
  ],
  "aliases": [
    "Independent Merchant Fleet",
    "Freelance Traders",
    "Star Traders",
    "Astro-Merchants"
  ],
  "relationships": [
    {
      "type": "appears_in",
      "target": "f0d9fb2a-0f3e-446a-9a1d-2db988b68967"
    },
    {
      "type": "operates_within",
      "target": "1f4e6103-1fbb-4ce2-b248-f5c1b5a5de5b"
    }
  ],
  "properties": {
    "primary_activity": "Trade and Commerce",
    "operating_regions": "Peripheral and frontier star systems",
    "organizational_type": "Loose Network",
    "relation_to_empire": "Autonomous/Independent"
  },
  "tags": [
    "Foundation Series",
    "Galactic Economy",
    "Space Traders",
    "Autonomy",
    "Science Fiction",
    "Isaac Asimov",
    "Interstellar Trade"
  ]
}