{
  "id": "fe4f2182-4056-4713-8491-8d53ad5c434b",
  "type": "character",
  "name": "Carmine Falcone",
  "description": "A powerful mob boss in Gotham City and a key figure in the criminal underworld.",
  "content": [
    {
      "title": "Background",
      "body": "Carmine Falcone is an influential figure in Gotham City's criminal underworld, known as the 'Roman' in the organized crime community. He has established a vast network of illegal activities and maintains significant control over city officials, police, and judges through corruption and intimidation."
    },
    {
      "title": "Personality",
      "body": "Falcone is ruthless, calculating, and highly manipulative, prioritizing power and control over any sense of morality. His motivations are largely driven by a desire to maintain his empire and influence in Gotham City. Despite his criminal nature, he maintains a demeanor of sophistication and calm."
    },
    {
      "title": "Story Role",
      "body": "In 'Batman Begins', Carmine Falcone serves as an antagonist. He is a major hurdle in Bruce Wayne's journey to clean Gotham City of its corruption. Falcone's operations and his connection to other criminal elements in the city paint a picture of the deep-rooted issues Bruce must address. Falcone's eventual downfall marks a turning point, symbolizing Batman's initial victory over Gotham's entrenched criminal system."
    },
    {
      "title": "Relationships",
      "body": "- **Bruce Wayne**: Falcone sees Bruce as someone who cannot understand the depths of crime in Gotham. However, their interactions motivate Bruce to take action against the city's corruption.\n- **Jonathan Crane**: He has a business relationship with Crane (Scarecrow), using Craneâ€™s fear gas to manipulate and control enemies.\n- **Rachel Dawes**: As a district attorney, Rachel represents the legal side of the fight against Falcone, symbolizing law and order."
    }
  ],
  "aliases": [
    "The Roman"
  ],
  "relationships": [
    {
      "type": "appears_in",
      "target": "fc1e827c-35d3-4aca-aae2-b7be4817a0bf"
    },
    {
      "type": "rivals_with",
      "target": "d1637915-9c46-4f38-af8b-6932a49e3746"
    },
    {
      "type": "member_of",
      "target": "d65b3a1e-5b3b-4a72-907d-fae2b0ef4f90"
    },
    {
      "type": "related_to",
      "target": "39f99bdf-9cce-4f89-8447-8ebaafb4e7e8"
    },
    {
      "type": "related_to",
      "target": "1e1d3e8d-c5f3-4d30-b4f3-45f6128ce7ed"
    }
  ],
  "properties": {
    "species": "human",
    "occupation": "mob boss",
    "portrayed_by": "Tom Wilkinson"
  },
  "tags": [
    "antagonist",
    "villain",
    "crime lord"
  ]
}