{
  "id": "ee1d3001-d3d9-49de-b463-03c1de2d3db3",
  "type": "character",
  "name": "Dr. Grimesby Roylott",
  "description": "A violent and cruel doctor who is the antagonist in The Adventure of the Speckled Band, known for using sinister methods to maintain control over his stepdaughters.",
  "content": [
    {
      "title": "Background",
      "body": "Dr. Grimesby Roylott is a wealthy and formidable man who serves as the stepfather to Helen and Julia Stoner. He has spent much of his life in India as a medical practitioner, accumulating a range of exotic pets and influences from his time abroad. On returning to England, he resides at the ancestral estate Stoke Moran, which he maintains with an oppressive grip, largely motivated by greed and rage over his late wife's inheritance going to her daughters."
    },
    {
      "title": "Personality",
      "body": "Royleott is portrayed as aggressive, hot-tempered, and physically intimidating, resorting to intimidation and violent threats, particularly against his stepdaughters. He exhibits a controlling and cruel nature, driven by greed and a desire to eliminate those who obstruct his access to the family wealth. His demeanor is menacing and volatile, underscoring his role as a threatening figure in the story."
    },
    {
      "title": "Story Role",
      "body": "As the primary antagonist, Dr. Roylott is responsible for the sinister events at Stoke Moran, including the mysterious death of Julia Stoner. His secret murder method involves the use of a venomous swamp adder, deployed to kill stealthily. Throughout the investigation, Roylott's suspicious conduct and violent background make him the prime suspect until Holmes uncovers his deadly scheme, which ultimately leads to Roylott's own demise."
    },
    {
      "title": "Relationships",
      "body": "Dr. Roylott is the stepfather of Helen and Julia Stoner, whom he abuses emotionally and physically, motivated by a desire to claim their inheritance after the death of his wife. His relationship with his stepdaughters is marked by tyranny and malice. He interacts with the household staff and local villagers with little kindness. Holmes and Watson confront him as adversaries, representing the forces of rational justice against his brutality."
    },
    {
      "title": "Abilities/Skills",
      "body": "Royleott is medically trained, having served as a doctor in colonial India. His knowledge of exotic animals is extensive, evident by his ownership of a variety of dangerous pets, including a baboon and a cheetah. He cleverly adapts his knowledge of venomous creatures to engineer a deadly murder method. His physical strength and aggressive nature enhance his threat level within the narrative."
    }
  ],
  "aliases": [
    "Dr. Roylott",
    "Doctor Grimesby Roylott",
    "The Villain of Stoke Moran"
  ],
  "relationships": [
    {
      "type": "stepfather_of",
      "target": "91d00a09-0b0a-4f4a-9548-f2c50668944d"
    },
    {
      "type": "stepfather_of",
      "target": "f06ae0e3-2d91-40fa-8bc6-ec62d8b9a65e"
    },
    {
      "type": "antagonist_in",
      "target": "35d0df0f-2cce-408e-8a3c-7e285e2bee16"
    },
    {
      "type": "appears_in",
      "target": "35d0df0f-2cce-408e-8a3c-7e285e2bee16"
    }
  ],
  "properties": {
    "occupation": "Physician",
    "nationality": "English",
    "residence": "Stoke Moran",
    "status": "Deceased",
    "time_period": "Late 19th century"
  },
  "tags": [
    "antagonist",
    "Sherlock Holmes villain",
    "murderer",
    "physician",
    "Victorian era",
    "criminal"
  ]
}